{
  "schema_version": 1,
  "version": "2026-10-30",
  "method": "本资料库编辑分类，参考公开机构研究；非机构官方统一标准。按主要产品交付归入一个主赛道，细分方向和交叉标签保留跨层业务。无求职匹配评分或优先级。",
  "references": [
    {
      "organization": "Sequoia Capital（美国）",
      "title": "Generative AI’s Act Two",
      "url": "https://sequoiacap.com/article/generative-ai-act-two/",
      "date": "2023-09-20",
      "finding": "文章明确把市场图谱从模型模态改为使用场景，并另外呈现 LLM 开发栈。",
      "adopted": "应用层按任务与客户场景分类；开发工具从通用 Agent 分离。"
    },
    {
      "organization": "a16z",
      "title": "Emerging Architectures for LLM Applications",
      "url": "https://a16z.com/emerging-architectures-for-llm-applications/",
      "date": "2023-06-20",
      "finding": "提供 LLM 应用架构：模型 API、云与托管、编排、数据管道、向量库、验证及可观测等组件。",
      "adopted": "区分模型、算力服务、开发工具与应用，避免将平台等同最终应用。"
    },
    {
      "organization": "a16z-infra / GitHub",
      "title": "LLM App Stack",
      "url": "https://github.com/a16z-infra/llm-app-stack",
      "date": "2026-10-30查阅",
      "finding": "按 LLM 应用栈组件分目录的工具与供应商清单。它是工程生态清单，不是中国企业投资名单。",
      "adopted": "使用功能标签组织平台、编排、推理等方向；不以 GitHub 收录推断投资关系。"
    },
    {
      "organization": "HongShan / 红杉中国",
      "title": "被投企业",
      "url": "https://www.hongshan.com/companies/",
      "date": "2026-10-30查阅",
      "finding": "公开页面使用科技、医疗、消费等行业标签，并声明仅展示部分成员企业。",
      "adopted": "保留行业属性；不虚构其官方 AI 十赛道分类，不以页面未收录推断未投资。"
    }
  ],
  "categories": [
    {
      "id": "01",
      "name": "基础模型",
      "boundary": "研发并提供可复用的通用、端侧或领域基础模型",
      "subtracks": [
        "通用与多模态模型",
        "端侧模型",
        "领域模型"
      ]
    },
    {
      "id": "02",
      "name": "算力与基础设施",
      "boundary": "芯片、互联网络、训练推理系统与模型服务底座",
      "subtracks": [
        "推理与模型服务",
        "异构算力与调度",
        "训练系统与云",
        "GPU芯片与集群网络"
      ]
    },
    {
      "id": "03",
      "name": "开发平台与编程工具",
      "boundary": "帮助开发者构建 AI 应用或完成软件开发",
      "subtracks": [
        "Agent工作流与开发平台",
        "AI编程"
      ]
    },
    {
      "id": "04",
      "name": "通用 Agent、个人应用与搜索",
      "boundary": "面向个人的跨领域任务执行、信息检索、翻译写作及天气等信息服务",
      "subtracks": [
        "通用任务执行",
        "个人助手",
        "搜索与知识研究",
        "翻译与文本助手",
        "天气与个人信息服务"
      ]
    },
    {
      "id": "05",
      "name": "多模态生成与创作工具",
      "boundary": "面向图像、视频、3D、数字人与设计生产的模型及应用",
      "subtracks": [
        "视频与动漫生成",
        "3D与世界模型",
        "图像社区与设计",
        "数字人与内容生产"
      ]
    },
    {
      "id": "06",
      "name": "企业与垂直行业软件",
      "boundary": "企业流程自动化及法律、销售、文档等专门任务",
      "subtracks": [
        "RPA与流程自动化",
        "企业Agent与数据平台",
        "法律与销售智能",
        "文档与商业信息"
      ]
    },
    {
      "id": "07",
      "name": "零售、电商与营销应用",
      "boundary": "围绕商品、商家、消费者服务与营销增长交付软件",
      "subtracks": [
        "商品视觉与商业内容",
        "客服与消费者洞察",
        "跨境运营与独立站",
        "营销投放与增长"
      ]
    },
    {
      "id": "08",
      "name": "具身智能与机器人",
      "boundary": "将感知、决策与操作部署到物理机器人",
      "subtracks": [
        "具身模型与操作",
        "人形与四足本体",
        "工业与服务机器人"
      ]
    },
    {
      "id": "09",
      "name": "AI 消费硬件",
      "boundary": "以面向个人的实体设备交付 AI 能力",
      "subtracks": [
        "穿戴与助力",
        "录音与办公硬件",
        "陪伴与交互硬件",
        "消费电子"
      ]
    },
    {
      "id": "10",
      "name": "科学智能与生物医药",
      "boundary": "面向药物、蛋白质、材料等研发及实验自动化",
      "subtracks": [
        "药物发现与临床管线",
        "蛋白质与生物大模型",
        "科学计算与材料",
        "自动化实验平台"
      ]
    }
  ],
  "caveats": [
    "79 家是原始赛道图收录的公司范围，不代表市场总体或投资份额。",
    "原机构表有30行，部分行合并多个机构或国资主体，不能称为30家独立基金。",
    "融资与投资方记录仅表示公开披露的历史关系，不等同当前完整股东名册或持续持仓。",
    "同类区别是基于产品定位的编辑分析，不是性能评测或公司排名。",
    "公开邮箱按招聘、商务、客服等用途区分；未公开不推测。"
  ]
}
